{
  "feedback_id": "FB-20261004-003",
  "fhtc_id": "FHTC-UP-245123-0003",
  "channel": "whatsapp",
  "category": "dirty_water",
  "text": "\u092a\u093e\u0928\u0940 \u092e\u0947\u0902 \u0917\u0902\u0926\u093e \u092e\u091f\u092e\u0948\u0932\u093e \u0930\u0902\u0917 \u0906 \u0930\u0939\u093e \u0939\u0948",
  "lang": "hi",
  "ts": "2026-10-04T09:30:00Z"
}